<?xml version="1.0"?>
<?xml-stylesheet type="text/xsl" href="pdml2html.xsl"?>
<!-- You can find pdml2html.xsl in /usr/share/wireshark or at https://code.wireshark.org/review/gitweb?p=wireshark.git;a=blob_plain;f=pdml2html.xsl. -->
<pdml version="0" creator="wireshark/2.0.1" time="Fri Feb 26 16:36:53 2016" capture_file="testData/ethereal.com.pcap">
<packet>
  <proto name="geninfo" pos="0" showname="General information" size="62">
    <field name="num" pos="0" show="1" showname="Number" value="1" size="62"/>
    <field name="len" pos="0" show="62" showname="Frame Length" value="3e" size="62"/>
    <field name="caplen" pos="0" show="62" showname="Captured Length" value="3e" size="62"/>
    <field name="timestamp" pos="0" show="Oct 29, 2004 15:32:23.758642000 CEST" showname="Captured Time" value="1099056743.758642000" size="62"/>
  </proto>
  <proto name="frame" showname="Frame 1: 62 bytes on wire (496 bits), 62 bytes captured (496 bits)" size="62" pos="0">
    <field name="frame.encap_type" showname="Encapsulation type: Ethernet (1)" size="0" pos="0" show="1"/>
    <field name="frame.time" showname="Arrival Time: Oct 29, 2004 15:32:23.758642000 CEST" size="0" pos="0" show="Oct 29, 2004 15:32:23.758642000 CEST"/>
    <field name="frame.offset_shift" showname="Time shift for this packet: 0.000000000 seconds" size="0" pos="0" show="0.000000000"/>
    <field name="frame.time_epoch" showname="Epoch Time: 1099056743.758642000 seconds" size="0" pos="0" show="1099056743.758642000"/>
    <field name="frame.time_delta" showname="Time delta from previous captured frame: 0.000000000 seconds" size="0" pos="0" show="0.000000000"/>
    <field name="frame.time_delta_displayed" showname="Time delta from previous displayed frame: 0.000000000 seconds" size="0" pos="0" show="0.000000000"/>
    <field name="frame.time_relative" showname="Time since reference or first frame: 0.000000000 seconds" size="0" pos="0" show="0.000000000"/>
    <field name="frame.number" showname="Frame Number: 1" size="0" pos="0" show="1"/>
    <field name="frame.len" showname="Frame Length: 62 bytes (496 bits)" size="0" pos="0" show="62"/>
    <field name="frame.cap_len" showname="Capture Length: 62 bytes (496 bits)" size="0" pos="0" show="62"/>
    <field name="frame.marked" showname="Frame is marked: False" size="0" pos="0" show="0"/>
    <field name="frame.ignored" showname="Frame is ignored: False" size="0" pos="0" show="0"/>
    <field name="frame.protocols" showname="Protocols in frame: eth:ethertype:ip:tcp" size="0" pos="0" show="eth:ethertype:ip:tcp"/>
  </proto>
  <proto name="eth" showname="Ethernet II, Src: BelkinCo_02:b8:ee (00:11:50:02:b8:ee), Dst: BelkinCo_fd:19:6a (00:30:bd:fd:19:6a)" size="14" pos="0">
    <field name="eth.dst" showname="Destination: BelkinCo_fd:19:6a (00:30:bd:fd:19:6a)" size="6" pos="0" show="00:30:bd:fd:19:6a" value="0030bdfd196a">
      <field name="eth.dst_resolved" showname="Destination (resolved): BelkinCo_fd:19:6a" hide="yes" size="6" pos="0" show="BelkinCo_fd:19:6a" value="0030bdfd196a"/>
      <field name="eth.addr" showname="Address: BelkinCo_fd:19:6a (00:30:bd:fd:19:6a)" size="6" pos="0" show="00:30:bd:fd:19:6a" value="0030bdfd196a"/>
      <field name="eth.addr_resolved" showname="Address (resolved): BelkinCo_fd:19:6a" hide="yes" size="6" pos="0" show="BelkinCo_fd:19:6a" value="0030bdfd196a"/>
      <field name="eth.lg" showname=".... ..0. .... .... .... .... = LG bit: Globally unique address (factory default)" size="3" pos="0" show="0" value="0" unmaskedvalue="0030bd"/>
      <field name="eth.ig" showname=".... ...0 .... .... .... .... = IG bit: Individual address (unicast)" size="3" pos="0" show="0" value="0" unmaskedvalue="0030bd"/>
    </field>
    <field name="eth.src" showname="Source: BelkinCo_02:b8:ee (00:11:50:02:b8:ee)" size="6" pos="6" show="00:11:50:02:b8:ee" value="00115002b8ee">
      <field name="eth.src_resolved" showname="Source (resolved): BelkinCo_02:b8:ee" hide="yes" size="6" pos="6" show="BelkinCo_02:b8:ee" value="00115002b8ee"/>
      <field name="eth.addr" showname="Address: BelkinCo_02:b8:ee (00:11:50:02:b8:ee)" size="6" pos="6" show="00:11:50:02:b8:ee" value="00115002b8ee"/>
      <field name="eth.addr_resolved" showname="Address (resolved): BelkinCo_02:b8:ee" hide="yes" size="6" pos="6" show="BelkinCo_02:b8:ee" value="00115002b8ee"/>
      <field name="eth.lg" showname=".... ..0. .... .... .... .... = LG bit: Globally unique address (factory default)" size="3" pos="6" show="0" value="0" unmaskedvalue="001150"/>
      <field name="eth.ig" showname=".... ...0 .... .... .... .... = IG bit: Individual address (unicast)" size="3" pos="6" show="0" value="0" unmaskedvalue="001150"/>
    </field>
    <field name="eth.type" showname="Type: IPv4 (0x0800)" size="2" pos="12" show="0x00000800" value="0800"/>
  </proto>
  <proto name="ip" showname="Internet Protocol Version 4, Src: 192.168.2.3, Dst: 65.208.228.223" size="20" pos="14">
    <field name="ip.version" showname="0100 .... = Version: 4" size="1" pos="14" show="4" value="4" unmaskedvalue="45"/>
    <field name="ip.hdr_len" showname=".... 0101 = Header Length: 20 bytes" size="1" pos="14" show="5" value="5" unmaskedvalue="45"/>
    <field name="ip.dsfield" showname="Differentiated Services Field: 0x00 (DSCP: CS0, ECN: Not-ECT)" size="1" pos="15" show="0x00000000" value="00">
      <field name="ip.dsfield.dscp" showname="0000 00.. = Differentiated Services Codepoint: Default (0)" size="1" pos="15" show="0" value="0" unmaskedvalue="00"/>
      <field name="ip.dsfield.ecn" showname=".... ..00 = Explicit Congestion Notification: Not ECN-Capable Transport (0)" size="1" pos="15" show="0" value="0" unmaskedvalue="00"/>
    </field>
    <field name="ip.len" showname="Total Length: 48" size="2" pos="16" show="48" value="0030"/>
    <field name="ip.id" showname="Identification: 0x03c7 (967)" size="2" pos="18" show="0x000003c7" value="03c7"/>
    <field name="ip.flags" showname="Flags: 0x02 (Don&#x27;t Fragment)" size="1" pos="20" show="0x00000002" value="40">
      <field name="ip.flags.rb" showname="0... .... = Reserved bit: Not set" size="1" pos="20" show="0" value="40"/>
      <field name="ip.flags.df" showname=".1.. .... = Don&#x27;t fragment: Set" size="1" pos="20" show="1" value="40"/>
      <field name="ip.flags.mf" showname="..0. .... = More fragments: Not set" size="1" pos="20" show="0" value="40"/>
    </field>
    <field name="ip.frag_offset" showname="Fragment offset: 0" size="2" pos="20" show="0" value="4000"/>
    <field name="ip.ttl" showname="Time to live: 128" size="1" pos="22" show="128" value="80"/>
    <field name="ip.proto" showname="Protocol: TCP (6)" size="1" pos="23" show="6" value="06"/>
    <field name="ip.checksum" showname="Header checksum: 0x0da6 [validation disabled]" size="2" pos="24" show="0x00000da6" value="0da6">
      <field name="ip.checksum_good" showname="Good: False" size="2" pos="24" show="0" value="0da6"/>
      <field name="ip.checksum_bad" showname="Bad: False" size="2" pos="24" show="0" value="0da6"/>
    </field>
    <field name="ip.src" showname="Source: 192.168.2.3" size="4" pos="26" show="192.168.2.3" value="c0a80203"/>
    <field name="ip.addr" showname="Source or Destination Address: 192.168.2.3" hide="yes" size="4" pos="26" show="192.168.2.3" value="c0a80203"/>
    <field name="ip.src_host" showname="Source Host: 192.168.2.3" hide="yes" size="4" pos="26" show="192.168.2.3" value="c0a80203"/>
    <field name="ip.host" showname="Source or Destination Host: 192.168.2.3" hide="yes" size="4" pos="26" show="192.168.2.3" value="c0a80203"/>
    <field name="ip.dst" showname="Destination: 65.208.228.223" size="4" pos="30" show="65.208.228.223" value="41d0e4df"/>
    <field name="ip.addr" showname="Source or Destination Address: 65.208.228.223" hide="yes" size="4" pos="30" show="65.208.228.223" value="41d0e4df"/>
    <field name="ip.dst_host" showname="Destination Host: 65.208.228.223" hide="yes" size="4" pos="30" show="65.208.228.223" value="41d0e4df"/>
    <field name="ip.host" showname="Source or Destination Host: 65.208.228.223" hide="yes" size="4" pos="30" show="65.208.228.223" value="41d0e4df"/>
  </proto>
  <proto name="tcp" showname="Transmission Control Protocol, Src Port: 1061 (1061), Dst Port: 80 (80), Seq: 0, Len: 0" size="28" pos="34">
    <field name="tcp.srcport" showname="Source Port: 1061" size="2" pos="34" show="1061" value="0425"/>
    <field name="tcp.dstport" showname="Destination Port: 80" size="2" pos="36" show="80" value="0050"/>
    <field name="tcp.port" showname="Source or Destination Port: 1061" hide="yes" size="2" pos="34" show="1061" value="0425"/>
    <field name="tcp.port" showname="Source or Destination Port: 80" hide="yes" size="2" pos="36" show="80" value="0050"/>
    <field name="tcp.stream" showname="Stream index: 0" size="0" pos="34" show="0"/>
    <field name="tcp.len" showname="TCP Segment Len: 0" size="1" pos="46" show="0" value="70"/>
    <field name="tcp.seq" showname="Sequence number: 0    (relative sequence number)" size="4" pos="38" show="0" value="93ddc1eb"/>
    <field name="tcp.ack" showname="Acknowledgment number: 0" size="4" pos="42" show="0" value="00000000"/>
    <field name="tcp.hdr_len" showname="Header Length: 28 bytes" size="1" pos="46" show="28" value="70"/>
    <field name="tcp.flags" showname="Flags: 0x002 (SYN)" size="2" pos="46" show="0x00000002" value="2" unmaskedvalue="7002">
      <field name="tcp.flags.res" showname="000. .... .... = Reserved: Not set" size="1" pos="46" show="0" value="0" unmaskedvalue="70"/>
      <field name="tcp.flags.ns" showname="...0 .... .... = Nonce: Not set" size="1" pos="46" show="0" value="0" unmaskedvalue="70"/>
      <field name="tcp.flags.cwr" showname=".... 0... .... = Congestion Window Reduced (CWR): Not set" size="1" pos="47" show="0" value="0" unmaskedvalue="02"/>
      <field name="tcp.flags.ecn" showname=".... .0.. .... = ECN-Echo: Not set" size="1" pos="47" show="0" value="0" unmaskedvalue="02"/>
      <field name="tcp.flags.urg" showname=".... ..0. .... = Urgent: Not set" size="1" pos="47" show="0" value="0" unmaskedvalue="02"/>
      <field name="tcp.flags.ack" showname=".... ...0 .... = Acknowledgment: Not set" size="1" pos="47" show="0" value="0" unmaskedvalue="02"/>
      <field name="tcp.flags.push" showname=".... .... 0... = Push: Not set" size="1" pos="47" show="0" value="0" unmaskedvalue="02"/>
      <field name="tcp.flags.reset" showname=".... .... .0.. = Reset: Not set" size="1" pos="47" show="0" value="0" unmaskedvalue="02"/>
      <field name="tcp.flags.syn" showname=".... .... ..1. = Syn: Set" size="1" pos="47" show="1" value="FFFFFFFF" unmaskedvalue="02">
        <field name="_ws.expert" showname="Expert Info (Chat/Sequence): Connection establish request (SYN): server port 80" size="0" pos="47">
          <field name="tcp.connection.syn" showname="Connection establish request (SYN): server port 80" size="0" pos="0" show="" value=""/>
          <field name="_ws.expert.message" showname="Message: Connection establish request (SYN): server port 80" hide="yes" size="0" pos="0" show="Connection establish request (SYN): server port 80"/>
          <field name="_ws.expert.severity" showname="Severity level: Chat" size="0" pos="0" show="0x00200000"/>
          <field name="_ws.expert.group" showname="Group: Sequence" size="0" pos="0" show="0x02000000"/>
        </field>
      </field>
      <field name="tcp.flags.fin" showname=".... .... ...0 = Fin: Not set" size="1" pos="47" show="0" value="0" unmaskedvalue="02"/>
      <field name="tcp.flags.str" showname="TCP Flags: **********S*" size="2" pos="46" show="**********S*" value="7002"/>
    </field>
    <field name="tcp.window_size_value" showname="Window size value: 16384" size="2" pos="48" show="16384" value="4000"/>
    <field name="tcp.window_size" showname="Calculated window size: 16384" size="2" pos="48" show="16384" value="4000"/>
    <field name="tcp.checksum" showname="Checksum: 0xff85 [validation disabled]" size="2" pos="50" show="0x0000ff85" value="ff85">
      <field name="tcp.checksum_good" showname="Good Checksum: False" size="2" pos="50" show="0" value="ff85"/>
      <field name="tcp.checksum_bad" showname="Bad Checksum: False" size="2" pos="50" show="0" value="ff85"/>
    </field>
    <field name="tcp.urgent_pointer" showname="Urgent pointer: 0" size="2" pos="52" show="0" value="0000"/>
    <field name="tcp.options" showname="Options: (8 bytes), Maximum segment size, No-Operation (NOP), No-Operation (NOP), SACK permitted" size="8" pos="54" show="02:04:05:b4:01:01:04:02" value="020405b401010402">
      <field name="tcp.options.mss" showname="Maximum segment size: 1460 bytes" size="4" pos="54" show="" value="">
        <field name="tcp.option_kind" showname="Kind: Maximum Segment Size (2)" size="1" pos="54" show="2" value="02"/>
        <field name="tcp.option_len" showname="Length: 4" size="1" pos="55" show="4" value="04"/>
        <field name="tcp.options.mss_val" showname="MSS Value: 1460" size="2" pos="56" show="1460" value="05b4"/>
      </field>
      <field name="" show="No-Operation (NOP)" size="1" pos="58" value="01">
        <field name="tcp.options.type" showname="Type: 1" size="1" pos="58" show="1" value="01">
          <field name="tcp.options.type.copy" showname="0... .... = Copy on fragmentation: No" size="1" pos="58" show="0" value="0" unmaskedvalue="01"/>
          <field name="tcp.options.type.class" showname=".00. .... = Class: Control (0)" size="1" pos="58" show="0" value="0" unmaskedvalue="01"/>
          <field name="tcp.options.type.number" showname="...0 0001 = Number: No-Operation (NOP) (1)" size="1" pos="58" show="1" value="1" unmaskedvalue="01"/>
        </field>
      </field>
      <field name="" show="No-Operation (NOP)" size="1" pos="59" value="01">
        <field name="tcp.options.type" showname="Type: 1" size="1" pos="59" show="1" value="01">
          <field name="tcp.options.type.copy" showname="0... .... = Copy on fragmentation: No" size="1" pos="59" show="0" value="0" unmaskedvalue="01"/>
          <field name="tcp.options.type.class" showname=".00. .... = Class: Control (0)" size="1" pos="59" show="0" value="0" unmaskedvalue="01"/>
          <field name="tcp.options.type.number" showname="...0 0001 = Number: No-Operation (NOP) (1)" size="1" pos="59" show="1" value="1" unmaskedvalue="01"/>
        </field>
      </field>
      <field name="tcp.options.sack_perm" showname="TCP SACK Permitted Option: True" size="2" pos="60" show="1" value="0402">
        <field name="tcp.option_kind" showname="Kind: SACK Permitted (4)" size="1" pos="60" show="4" value="04"/>
        <field name="tcp.option_len" showname="Length: 2" size="1" pos="61" show="2" value="02"/>
      </field>
    </field>
  </proto>
</packet>


<packet>
  <proto name="geninfo" pos="0" showname="General information" size="62">
    <field name="num" pos="0" show="2" showname="Number" value="2" size="62"/>
    <field name="len" pos="0" show="62" showname="Frame Length" value="3e" size="62"/>
    <field name="caplen" pos="0" show="62" showname="Captured Length" value="3e" size="62"/>
    <field name="timestamp" pos="0" show="Oct 29, 2004 15:32:23.822232000 CEST" showname="Captured Time" value="1099056743.822232000" size="62"/>
  </proto>
  <proto name="frame" showname="Frame 2: 62 bytes on wire (496 bits), 62 bytes captured (496 bits)" size="62" pos="0">
    <field name="frame.encap_type" showname="Encapsulation type: Ethernet (1)" size="0" pos="0" show="1"/>
    <field name="frame.time" showname="Arrival Time: Oct 29, 2004 15:32:23.822232000 CEST" size="0" pos="0" show="Oct 29, 2004 15:32:23.822232000 CEST"/>
    <field name="frame.offset_shift" showname="Time shift for this packet: 0.000000000 seconds" size="0" pos="0" show="0.000000000"/>
    <field name="frame.time_epoch" showname="Epoch Time: 1099056743.822232000 seconds" size="0" pos="0" show="1099056743.822232000"/>
    <field name="frame.time_delta" showname="Time delta from previous captured frame: 0.063590000 seconds" size="0" pos="0" show="0.063590000"/>
    <field name="frame.time_delta_displayed" showname="Time delta from previous displayed frame: 0.063590000 seconds" size="0" pos="0" show="0.063590000"/>
    <field name="frame.time_relative" showname="Time since reference or first frame: 0.063590000 seconds" size="0" pos="0" show="0.063590000"/>
    <field name="frame.number" showname="Frame Number: 2" size="0" pos="0" show="2"/>
    <field name="frame.len" showname="Frame Length: 62 bytes (496 bits)" size="0" pos="0" show="62"/>
    <field name="frame.cap_len" showname="Capture Length: 62 bytes (496 bits)" size="0" pos="0" show="62"/>
    <field name="frame.marked" showname="Frame is marked: False" size="0" pos="0" show="0"/>
    <field name="frame.ignored" showname="Frame is ignored: False" size="0" pos="0" show="0"/>
    <field name="frame.protocols" showname="Protocols in frame: eth:ethertype:ip:tcp" size="0" pos="0" show="eth:ethertype:ip:tcp"/>
  </proto>
  <proto name="eth" showname="Ethernet II, Src: BelkinCo_fd:19:6a (00:30:bd:fd:19:6a), Dst: BelkinCo_02:b8:ee (00:11:50:02:b8:ee)" size="14" pos="0">
    <field name="eth.dst" showname="Destination: BelkinCo_02:b8:ee (00:11:50:02:b8:ee)" size="6" pos="0" show="00:11:50:02:b8:ee" value="00115002b8ee">
      <field name="eth.dst_resolved" showname="Destination (resolved): BelkinCo_02:b8:ee" hide="yes" size="6" pos="0" show="BelkinCo_02:b8:ee" value="00115002b8ee"/>
      <field name="eth.addr" showname="Address: BelkinCo_02:b8:ee (00:11:50:02:b8:ee)" size="6" pos="0" show="00:11:50:02:b8:ee" value="00115002b8ee"/>
      <field name="eth.addr_resolved" showname="Address (resolved): BelkinCo_02:b8:ee" hide="yes" size="6" pos="0" show="BelkinCo_02:b8:ee" value="00115002b8ee"/>
      <field name="eth.lg" showname=".... ..0. .... .... .... .... = LG bit: Globally unique address (factory default)" size="3" pos="0" show="0" value="0" unmaskedvalue="001150"/>
      <field name="eth.ig" showname=".... ...0 .... .... .... .... = IG bit: Individual address (unicast)" size="3" pos="0" show="0" value="0" unmaskedvalue="001150"/>
    </field>
    <field name="eth.src" showname="Source: BelkinCo_fd:19:6a (00:30:bd:fd:19:6a)" size="6" pos="6" show="00:30:bd:fd:19:6a" value="0030bdfd196a">
      <field name="eth.src_resolved" showname="Source (resolved): BelkinCo_fd:19:6a" hide="yes" size="6" pos="6" show="BelkinCo_fd:19:6a" value="0030bdfd196a"/>
      <field name="eth.addr" showname="Address: BelkinCo_fd:19:6a (00:30:bd:fd:19:6a)" size="6" pos="6" show="00:30:bd:fd:19:6a" value="0030bdfd196a"/>
      <field name="eth.addr_resolved" showname="Address (resolved): BelkinCo_fd:19:6a" hide="yes" size="6" pos="6" show="BelkinCo_fd:19:6a" value="0030bdfd196a"/>
      <field name="eth.lg" showname=".... ..0. .... .... .... .... = LG bit: Globally unique address (factory default)" size="3" pos="6" show="0" value="0" unmaskedvalue="0030bd"/>
      <field name="eth.ig" showname=".... ...0 .... .... .... .... = IG bit: Individual address (unicast)" size="3" pos="6" show="0" value="0" unmaskedvalue="0030bd"/>
    </field>
    <field name="eth.type" showname="Type: IPv4 (0x0800)" size="2" pos="12" show="0x00000800" value="0800"/>
  </proto>
  <proto name="ip" showname="Internet Protocol Version 4, Src: 65.208.228.223, Dst: 192.168.2.3" size="20" pos="14">
    <field name="ip.version" showname="0100 .... = Version: 4" size="1" pos="14" show="4" value="4" unmaskedvalue="45"/>
    <field name="ip.hdr_len" showname=".... 0101 = Header Length: 20 bytes" size="1" pos="14" show="5" value="5" unmaskedvalue="45"/>
    <field name="ip.dsfield" showname="Differentiated Services Field: 0x00 (DSCP: CS0, ECN: Not-ECT)" size="1" pos="15" show="0x00000000" value="00">
      <field name="ip.dsfield.dscp" showname="0000 00.. = Differentiated Services Codepoint: Default (0)" size="1" pos="15" show="0" value="0" unmaskedvalue="00"/>
      <field name="ip.dsfield.ecn" showname=".... ..00 = Explicit Congestion Notification: Not ECN-Capable Transport (0)" size="1" pos="15" show="0" value="0" unmaskedvalue="00"/>
    </field>
    <field name="ip.len" showname="Total Length: 48" size="2" pos="16" show="48" value="0030"/>
    <field name="ip.id" showname="Identification: 0x0000 (0)" size="2" pos="18" show="0x00000000" value="0000"/>
    <field name="ip.flags" showname="Flags: 0x02 (Don&#x27;t Fragment)" size="1" pos="20" show="0x00000002" value="40">
      <field name="ip.flags.rb" showname="0... .... = Reserved bit: Not set" size="1" pos="20" show="0" value="40"/>
      <field name="ip.flags.df" showname=".1.. .... = Don&#x27;t fragment: Set" size="1" pos="20" show="1" value="40"/>
      <field name="ip.flags.mf" showname="..0. .... = More fragments: Not set" size="1" pos="20" show="0" value="40"/>
    </field>
    <field name="ip.frag_offset" showname="Fragment offset: 0" size="2" pos="20" show="0" value="4000"/>
    <field name="ip.ttl" showname="Time to live: 47" size="1" pos="22" show="47" value="2f"/>
    <field name="ip.proto" showname="Protocol: TCP (6)" size="1" pos="23" show="6" value="06"/>
    <field name="ip.checksum" showname="Header checksum: 0x626d [validation disabled]" size="2" pos="24" show="0x0000626d" value="626d">
      <field name="ip.checksum_good" showname="Good: False" size="2" pos="24" show="0" value="626d"/>
      <field name="ip.checksum_bad" showname="Bad: False" size="2" pos="24" show="0" value="626d"/>
    </field>
    <field name="ip.src" showname="Source: 65.208.228.223" size="4" pos="26" show="65.208.228.223" value="41d0e4df"/>
    <field name="ip.addr" showname="Source or Destination Address: 65.208.228.223" hide="yes" size="4" pos="26" show="65.208.228.223" value="41d0e4df"/>
    <field name="ip.src_host" showname="Source Host: 65.208.228.223" hide="yes" size="4" pos="26" show="65.208.228.223" value="41d0e4df"/>
    <field name="ip.host" showname="Source or Destination Host: 65.208.228.223" hide="yes" size="4" pos="26" show="65.208.228.223" value="41d0e4df"/>
    <field name="ip.dst" showname="Destination: 192.168.2.3" size="4" pos="30" show="192.168.2.3" value="c0a80203"/>
    <field name="ip.addr" showname="Source or Destination Address: 192.168.2.3" hide="yes" size="4" pos="30" show="192.168.2.3" value="c0a80203"/>
    <field name="ip.dst_host" showname="Destination Host: 192.168.2.3" hide="yes" size="4" pos="30" show="192.168.2.3" value="c0a80203"/>
    <field name="ip.host" showname="Source or Destination Host: 192.168.2.3" hide="yes" size="4" pos="30" show="192.168.2.3" value="c0a80203"/>
  </proto>
  <proto name="tcp" showname="Transmission Control Protocol, Src Port: 80 (80), Dst Port: 1061 (1061), Seq: 0, Ack: 1, Len: 0" size="28" pos="34">
    <field name="tcp.srcport" showname="Source Port: 80" size="2" pos="34" show="80" value="0050"/>
    <field name="tcp.dstport" showname="Destination Port: 1061" size="2" pos="36" show="1061" value="0425"/>
    <field name="tcp.port" showname="Source or Destination Port: 80" hide="yes" size="2" pos="34" show="80" value="0050"/>
    <field name="tcp.port" showname="Source or Destination Port: 1061" hide="yes" size="2" pos="36" show="1061" value="0425"/>
    <field name="tcp.stream" showname="Stream index: 0" size="0" pos="34" show="0"/>
    <field name="tcp.len" showname="TCP Segment Len: 0" size="1" pos="46" show="0" value="70"/>
    <field name="tcp.seq" showname="Sequence number: 0    (relative sequence number)" size="4" pos="38" show="0" value="15b78036"/>
    <field name="tcp.ack" showname="Acknowledgment number: 1    (relative ack number)" size="4" pos="42" show="1" value="93ddc1ec"/>
    <field name="tcp.hdr_len" showname="Header Length: 28 bytes" size="1" pos="46" show="28" value="70"/>
    <field name="tcp.flags" showname="Flags: 0x012 (SYN, ACK)" size="2" pos="46" show="0x00000012" value="12" unmaskedvalue="7012">
      <field name="tcp.flags.res" showname="000. .... .... = Reserved: Not set" size="1" pos="46" show="0" value="0" unmaskedvalue="70"/>
      <field name="tcp.flags.ns" showname="...0 .... .... = Nonce: Not set" size="1" pos="46" show="0" value="0" unmaskedvalue="70"/>
      <field name="tcp.flags.cwr" showname=".... 0... .... = Congestion Window Reduced (CWR): Not set" size="1" pos="47" show="0" value="0" unmaskedvalue="12"/>
      <field name="tcp.flags.ecn" showname=".... .0.. .... = ECN-Echo: Not set" size="1" pos="47" show="0" value="0" unmaskedvalue="12"/>
      <field name="tcp.flags.urg" showname=".... ..0. .... = Urgent: Not set" size="1" pos="47" show="0" value="0" unmaskedvalue="12"/>
      <field name="tcp.flags.ack" showname=".... ...1 .... = Acknowledgment: Set" size="1" pos="47" show="1" value="FFFFFFFF" unmaskedvalue="12"/>
      <field name="tcp.flags.push" showname=".... .... 0... = Push: Not set" size="1" pos="47" show="0" value="0" unmaskedvalue="12"/>
      <field name="tcp.flags.reset" showname=".... .... .0.. = Reset: Not set" size="1" pos="47" show="0" value="0" unmaskedvalue="12"/>
      <field name="tcp.flags.syn" showname=".... .... ..1. = Syn: Set" size="1" pos="47" show="1" value="FFFFFFFF" unmaskedvalue="12">
        <field name="_ws.expert" showname="Expert Info (Chat/Sequence): Connection establish acknowledge (SYN+ACK): server port 80" size="0" pos="47">
          <field name="tcp.connection.sack" showname="Connection establish acknowledge (SYN+ACK): server port 80" size="0" pos="0" show="" value=""/>
          <field name="_ws.expert.message" showname="Message: Connection establish acknowledge (SYN+ACK): server port 80" hide="yes" size="0" pos="0" show="Connection establish acknowledge (SYN+ACK): server port 80"/>
          <field name="_ws.expert.severity" showname="Severity level: Chat" size="0" pos="0" show="0x00200000"/>
          <field name="_ws.expert.group" showname="Group: Sequence" size="0" pos="0" show="0x02000000"/>
        </field>
      </field>
      <field name="tcp.flags.fin" showname=".... .... ...0 = Fin: Not set" size="1" pos="47" show="0" value="0" unmaskedvalue="12"/>
      <field name="tcp.flags.str" showname="TCP Flags: *******A**S*" size="2" pos="46" show="*******A**S*" value="7012"/>
    </field>
    <field name="tcp.window_size_value" showname="Window size value: 5840" size="2" pos="48" show="5840" value="16d0"/>
    <field name="tcp.window_size" showname="Calculated window size: 5840" size="2" pos="48" show="5840" value="16d0"/>
    <field name="tcp.checksum" showname="Checksum: 0x9307 [validation disabled]" size="2" pos="50" show="0x00009307" value="9307">
      <field name="tcp.checksum_good" showname="Good Checksum: False" size="2" pos="50" show="0" value="9307"/>
      <field name="tcp.checksum_bad" showname="Bad Checksum: False" size="2" pos="50" show="0" value="9307"/>
    </field>
    <field name="tcp.urgent_pointer" showname="Urgent pointer: 0" size="2" pos="52" show="0" value="0000"/>
    <field name="tcp.options" showname="Options: (8 bytes), Maximum segment size, No-Operation (NOP), No-Operation (NOP), SACK permitted" size="8" pos="54" show="02:04:05:64:01:01:04:02" value="0204056401010402">
      <field name="tcp.options.mss" showname="Maximum segment size: 1380 bytes" size="4" pos="54" show="" value="">
        <field name="tcp.option_kind" showname="Kind: Maximum Segment Size (2)" size="1" pos="54" show="2" value="02"/>
        <field name="tcp.option_len" showname="Length: 4" size="1" pos="55" show="4" value="04"/>
        <field name="tcp.options.mss_val" showname="MSS Value: 1380" size="2" pos="56" show="1380" value="0564"/>
      </field>
      <field name="" show="No-Operation (NOP)" size="1" pos="58" value="01">
        <field name="tcp.options.type" showname="Type: 1" size="1" pos="58" show="1" value="01">
          <field name="tcp.options.type.copy" showname="0... .... = Copy on fragmentation: No" size="1" pos="58" show="0" value="0" unmaskedvalue="01"/>
          <field name="tcp.options.type.class" showname=".00. .... = Class: Control (0)" size="1" pos="58" show="0" value="0" unmaskedvalue="01"/>
          <field name="tcp.options.type.number" showname="...0 0001 = Number: No-Operation (NOP) (1)" size="1" pos="58" show="1" value="1" unmaskedvalue="01"/>
        </field>
      </field>
      <field name="" show="No-Operation (NOP)" size="1" pos="59" value="01">
        <field name="tcp.options.type" showname="Type: 1" size="1" pos="59" show="1" value="01">
          <field name="tcp.options.type.copy" showname="0... .... = Copy on fragmentation: No" size="1" pos="59" show="0" value="0" unmaskedvalue="01"/>
          <field name="tcp.options.type.class" showname=".00. .... = Class: Control (0)" size="1" pos="59" show="0" value="0" unmaskedvalue="01"/>
          <field name="tcp.options.type.number" showname="...0 0001 = Number: No-Operation (NOP) (1)" size="1" pos="59" show="1" value="1" unmaskedvalue="01"/>
        </field>
      </field>
      <field name="tcp.options.sack_perm" showname="TCP SACK Permitted Option: True" size="2" pos="60" show="1" value="0402">
        <field name="tcp.option_kind" showname="Kind: SACK Permitted (4)" size="1" pos="60" show="4" value="04"/>
        <field name="tcp.option_len" showname="Length: 2" size="1" pos="61" show="2" value="02"/>
      </field>
    </field>
    <field name="tcp.analysis" showname="SEQ/ACK analysis" size="0" pos="34" show="" value="">
      <field name="tcp.analysis.acks_frame" showname="This is an ACK to the segment in frame: 1" size="0" pos="34" show="1"/>
      <field name="tcp.analysis.ack_rtt" showname="The RTT to ACK the segment was: 0.063590000 seconds" size="0" pos="34" show="0.063590000"/>
    </field>
  </proto>
</packet>


<packet>
  <proto name="geninfo" pos="0" showname="General information" size="54">
    <field name="num" pos="0" show="3" showname="Number" value="3" size="54"/>
    <field name="len" pos="0" show="54" showname="Frame Length" value="36" size="54"/>
    <field name="caplen" pos="0" show="54" showname="Captured Length" value="36" size="54"/>
    <field name="timestamp" pos="0" show="Oct 29, 2004 15:32:23.822307000 CEST" showname="Captured Time" value="1099056743.822307000" size="54"/>
  </proto>
  <proto name="frame" showname="Frame 3: 54 bytes on wire (432 bits), 54 bytes captured (432 bits)" size="54" pos="0">
    <field name="frame.encap_type" showname="Encapsulation type: Ethernet (1)" size="0" pos="0" show="1"/>
    <field name="frame.time" showname="Arrival Time: Oct 29, 2004 15:32:23.822307000 CEST" size="0" pos="0" show="Oct 29, 2004 15:32:23.822307000 CEST"/>
    <field name="frame.offset_shift" showname="Time shift for this packet: 0.000000000 seconds" size="0" pos="0" show="0.000000000"/>
    <field name="frame.time_epoch" showname="Epoch Time: 1099056743.822307000 seconds" size="0" pos="0" show="1099056743.822307000"/>
    <field name="frame.time_delta" showname="Time delta from previous captured frame: 0.000075000 seconds" size="0" pos="0" show="0.000075000"/>
    <field name="frame.time_delta_displayed" showname="Time delta from previous displayed frame: 0.000075000 seconds" size="0" pos="0" show="0.000075000"/>
    <field name="frame.time_relative" showname="Time since reference or first frame: 0.063665000 seconds" size="0" pos="0" show="0.063665000"/>
    <field name="frame.number" showname="Frame Number: 3" size="0" pos="0" show="3"/>
    <field name="frame.len" showname="Frame Length: 54 bytes (432 bits)" size="0" pos="0" show="54"/>
    <field name="frame.cap_len" showname="Capture Length: 54 bytes (432 bits)" size="0" pos="0" show="54"/>
    <field name="frame.marked" showname="Frame is marked: False" size="0" pos="0" show="0"/>
    <field name="frame.ignored" showname="Frame is ignored: False" size="0" pos="0" show="0"/>
    <field name="frame.protocols" showname="Protocols in frame: eth:ethertype:ip:tcp" size="0" pos="0" show="eth:ethertype:ip:tcp"/>
  </proto>
  <proto name="eth" showname="Ethernet II, Src: BelkinCo_02:b8:ee (00:11:50:02:b8:ee), Dst: BelkinCo_fd:19:6a (00:30:bd:fd:19:6a)" size="14" pos="0">
    <field name="eth.dst" showname="Destination: BelkinCo_fd:19:6a (00:30:bd:fd:19:6a)" size="6" pos="0" show="00:30:bd:fd:19:6a" value="0030bdfd196a">
      <field name="eth.dst_resolved" showname="Destination (resolved): BelkinCo_fd:19:6a" hide="yes" size="6" pos="0" show="BelkinCo_fd:19:6a" value="0030bdfd196a"/>
      <field name="eth.addr" showname="Address: BelkinCo_fd:19:6a (00:30:bd:fd:19:6a)" size="6" pos="0" show="00:30:bd:fd:19:6a" value="0030bdfd196a"/>
      <field name="eth.addr_resolved" showname="Address (resolved): BelkinCo_fd:19:6a" hide="yes" size="6" pos="0" show="BelkinCo_fd:19:6a" value="0030bdfd196a"/>
      <field name="eth.lg" showname=".... ..0. .... .... .... .... = LG bit: Globally unique address (factory default)" size="3" pos="0" show="0" value="0" unmaskedvalue="0030bd"/>
      <field name="eth.ig" showname=".... ...0 .... .... .... .... = IG bit: Individual address (unicast)" size="3" pos="0" show="0" value="0" unmaskedvalue="0030bd"/>
    </field>
    <field name="eth.src" showname="Source: BelkinCo_02:b8:ee (00:11:50:02:b8:ee)" size="6" pos="6" show="00:11:50:02:b8:ee" value="00115002b8ee">
      <field name="eth.src_resolved" showname="Source (resolved): BelkinCo_02:b8:ee" hide="yes" size="6" pos="6" show="BelkinCo_02:b8:ee" value="00115002b8ee"/>
      <field name="eth.addr" showname="Address: BelkinCo_02:b8:ee (00:11:50:02:b8:ee)" size="6" pos="6" show="00:11:50:02:b8:ee" value="00115002b8ee"/>
      <field name="eth.addr_resolved" showname="Address (resolved): BelkinCo_02:b8:ee" hide="yes" size="6" pos="6" show="BelkinCo_02:b8:ee" value="00115002b8ee"/>
      <field name="eth.lg" showname=".... ..0. .... .... .... .... = LG bit: Globally unique address (factory default)" size="3" pos="6" show="0" value="0" unmaskedvalue="001150"/>
      <field name="eth.ig" showname=".... ...0 .... .... .... .... = IG bit: Individual address (unicast)" size="3" pos="6" show="0" value="0" unmaskedvalue="001150"/>
    </field>
    <field name="eth.type" showname="Type: IPv4 (0x0800)" size="2" pos="12" show="0x00000800" value="0800"/>
  </proto>
  <proto name="ip" showname="Internet Protocol Version 4, Src: 192.168.2.3, Dst: 65.208.228.223" size="20" pos="14">
    <field name="ip.version" showname="0100 .... = Version: 4" size="1" pos="14" show="4" value="4" unmaskedvalue="45"/>
    <field name="ip.hdr_len" showname=".... 0101 = Header Length: 20 bytes" size="1" pos="14" show="5" value="5" unmaskedvalue="45"/>
    <field name="ip.dsfield" showname="Differentiated Services Field: 0x00 (DSCP: CS0, ECN: Not-ECT)" size="1" pos="15" show="0x00000000" value="00">
      <field name="ip.dsfield.dscp" showname="0000 00.. = Differentiated Services Codepoint: Default (0)" size="1" pos="15" show="0" value="0" unmaskedvalue="00"/>
      <field name="ip.dsfield.ecn" showname=".... ..00 = Explicit Congestion Notification: Not ECN-Capable Transport (0)" size="1" pos="15" show="0" value="0" unmaskedvalue="00"/>
    </field>
    <field name="ip.len" showname="Total Length: 40" size="2" pos="16" show="40" value="0028"/>
    <field name="ip.id" showname="Identification: 0x03c8 (968)" size="2" pos="18" show="0x000003c8" value="03c8"/>
    <field name="ip.flags" showname="Flags: 0x02 (Don&#x27;t Fragment)" size="1" pos="20" show="0x00000002" value="40">
      <field name="ip.flags.rb" showname="0... .... = Reserved bit: Not set" size="1" pos="20" show="0" value="40"/>
      <field name="ip.flags.df" showname=".1.. .... = Don&#x27;t fragment: Set" size="1" pos="20" show="1" value="40"/>
      <field name="ip.flags.mf" showname="..0. .... = More fragments: Not set" size="1" pos="20" show="0" value="40"/>
    </field>
    <field name="ip.frag_offset" showname="Fragment offset: 0" size="2" pos="20" show="0" value="4000"/>
    <field name="ip.ttl" showname="Time to live: 128" size="1" pos="22" show="128" value="80"/>
    <field name="ip.proto" showname="Protocol: TCP (6)" size="1" pos="23" show="6" value="06"/>
    <field name="ip.checksum" showname="Header checksum: 0x0dad [validation disabled]" size="2" pos="24" show="0x00000dad" value="0dad">
      <field name="ip.checksum_good" showname="Good: False" size="2" pos="24" show="0" value="0dad"/>
      <field name="ip.checksum_bad" showname="Bad: False" size="2" pos="24" show="0" value="0dad"/>
    </field>
    <field name="ip.src" showname="Source: 192.168.2.3" size="4" pos="26" show="192.168.2.3" value="c0a80203"/>
    <field name="ip.addr" showname="Source or Destination Address: 192.168.2.3" hide="yes" size="4" pos="26" show="192.168.2.3" value="c0a80203"/>
    <field name="ip.src_host" showname="Source Host: 192.168.2.3" hide="yes" size="4" pos="26" show="192.168.2.3" value="c0a80203"/>
    <field name="ip.host" showname="Source or Destination Host: 192.168.2.3" hide="yes" size="4" pos="26" show="192.168.2.3" value="c0a80203"/>
    <field name="ip.dst" showname="Destination: 65.208.228.223" size="4" pos="30" show="65.208.228.223" value="41d0e4df"/>
    <field name="ip.addr" showname="Source or Destination Address: 65.208.228.223" hide="yes" size="4" pos="30" show="65.208.228.223" value="41d0e4df"/>
    <field name="ip.dst_host" showname="Destination Host: 65.208.228.223" hide="yes" size="4" pos="30" show="65.208.228.223" value="41d0e4df"/>
    <field name="ip.host" showname="Source or Destination Host: 65.208.228.223" hide="yes" size="4" pos="30" show="65.208.228.223" value="41d0e4df"/>
  </proto>
  <proto name="tcp" showname="Transmission Control Protocol, Src Port: 1061 (1061), Dst Port: 80 (80), Seq: 1, Ack: 1, Len: 0" size="20" pos="34">
    <field name="tcp.srcport" showname="Source Port: 1061" size="2" pos="34" show="1061" value="0425"/>
    <field name="tcp.dstport" showname="Destination Port: 80" size="2" pos="36" show="80" value="0050"/>
    <field name="tcp.port" showname="Source or Destination Port: 1061" hide="yes" size="2" pos="34" show="1061" value="0425"/>
    <field name="tcp.port" showname="Source or Destination Port: 80" hide="yes" size="2" pos="36" show="80" value="0050"/>
    <field name="tcp.stream" showname="Stream index: 0" size="0" pos="34" show="0"/>
    <field name="tcp.len" showname="TCP Segment Len: 0" size="1" pos="46" show="0" value="50"/>
    <field name="tcp.seq" showname="Sequence number: 1    (relative sequence number)" size="4" pos="38" show="1" value="93ddc1ec"/>
    <field name="tcp.ack" showname="Acknowledgment number: 1    (relative ack number)" size="4" pos="42" show="1" value="15b78037"/>
    <field name="tcp.hdr_len" showname="Header Length: 20 bytes" size="1" pos="46" show="20" value="50"/>
    <field name="tcp.flags" showname="Flags: 0x010 (ACK)" size="2" pos="46" show="0x00000010" value="10" unmaskedvalue="5010">
      <field name="tcp.flags.res" showname="000. .... .... = Reserved: Not set" size="1" pos="46" show="0" value="0" unmaskedvalue="50"/>
      <field name="tcp.flags.ns" showname="...0 .... .... = Nonce: Not set" size="1" pos="46" show="0" value="0" unmaskedvalue="50"/>
      <field name="tcp.flags.cwr" showname=".... 0... .... = Congestion Window Reduced (CWR): Not set" size="1" pos="47" show="0" value="0" unmaskedvalue="10"/>
      <field name="tcp.flags.ecn" showname=".... .0.. .... = ECN-Echo: Not set" size="1" pos="47" show="0" value="0" unmaskedvalue="10"/>
      <field name="tcp.flags.urg" showname=".... ..0. .... = Urgent: Not set" size="1" pos="47" show="0" value="0" unmaskedvalue="10"/>
      <field name="tcp.flags.ack" showname=".... ...1 .... = Acknowledgment: Set" size="1" pos="47" show="1" value="FFFFFFFF" unmaskedvalue="10"/>
      <field name="tcp.flags.push" showname=".... .... 0... = Push: Not set" size="1" pos="47" show="0" value="0" unmaskedvalue="10"/>
      <field name="tcp.flags.reset" showname=".... .... .0.. = Reset: Not set" size="1" pos="47" show="0" value="0" unmaskedvalue="10"/>
